{
  "kind": "approval.checkpoint",
  "schemaVersion": 1,
  "checkpointId": "approval:m18:prep-source:pk-l01",
  "runId": "f52234ef-a04f-42e1-ae25-b82defbd1392",
  "approvalPolicy": "strict",
  "outcome": "approve",
  "state": "approved",
  "recordedAt": "2026-03-18T00:00:00Z",
  "expiresAt": "2026-03-18T02:00:00Z",
  "artifactProfileId": "m18:prep-source:pk-l01",
  "artifactIds": ["artifact:m18:prep-source:pk-l01"],
  "trace": {
    "traceNamespace": "trace:m18:prep-source",
    "receiptNamespace": "receipt:m18:prep-source",
    "routeLawNamespace": "route-law:m18:prep-source",
    "approvalNamespace": "approval:m18:prep-source",
    "correlationId": "corr:m18:prep-source:pk-l01"
  }
}
