{
  "kind": "approval.checkpoint",
  "schemaVersion": 1,
  "checkpointId": "approval:m18:official-richer-helper:checkpoint-01",
  "runId": "run:m18:official-richer-helper:01",
  "approvalPolicy": "strict",
  "outcome": "approve",
  "state": "approved",
  "recordedAt": "2026-03-18T00:00:00Z",
  "expiresAt": "2026-03-18T02:00:00Z",
  "artifactProfileId": "m18:official-richer-helper:profile-01",
  "artifactIds": ["artifact:m18:official-richer-helper:receipt-bundle"],
  "trace": {
    "traceNamespace": "trace:m18:official-richer-helper",
    "receiptNamespace": "receipt:m18:official-richer-helper",
    "routeLawNamespace": "route-law:m18:official-richer-helper",
    "approvalNamespace": "approval:m18:official-richer-helper",
    "correlationId": "corr:m18:official-richer-helper:01"
  }
}
